{
  "$schema": "https://json-schema.org/draft/2020-12/schema",
  "$id": "https://studio.cypherxcypher.de/catalog/v1/catalog.schema.json",
  "title": "Cypher Studio Katalog (Schema 1)",
  "type": "object",
  "required": ["schemaVersion", "sequence", "generatedAt", "expiresAt", "minAppVersion", "programs", "links", "printProfiles"],
  "additionalProperties": false,
  "properties": {
    "schemaVersion": { "const": 1 },
    "sequence": { "type": "integer", "minimum": 1, "description": "streng steigend, Rollback-Schutz" },
    "generatedAt": { "type": "string", "format": "date-time" },
    "expiresAt": { "type": "string", "format": "date-time" },
    "minAppVersion": { "$ref": "#/$defs/semver" },
    "programs": { "type": "array", "items": { "$ref": "#/$defs/program" } },
    "links": { "type": "array", "items": { "$ref": "#/$defs/link" } },
    "printProfiles": { "type": "array", "items": { "$ref": "#/$defs/printProfile" } },
    "models": { "type": "array", "items": { "$ref": "#/$defs/model" }, "default": [] }
  },
  "$defs": {
    "id": { "type": "string", "pattern": "^[a-z0-9]+(-[a-z0-9]+)*$", "maxLength": 40 },
    "semver": { "type": "string", "pattern": "^\\d+\\.\\d+\\.\\d+([-+][0-9A-Za-z.-]+)?$" },
    "programVersion": {
      "type": "string",
      "pattern": "^\\d+(\\.\\d+){1,3}([-+][0-9A-Za-z.-]+)?$",
      "description": "punktnumerisch, z. B. 5.3.4.1 oder 26.08.2 (kein SemVer!)"
    },
    "sha256": { "type": "string", "pattern": "^[0-9a-f]{64}$" },
    "httpsUrl": { "type": "string", "pattern": "^https://[^\\s@]+$", "maxLength": 512 },
    "relPath": { "type": "string", "pattern": "^(?!/)(?!.*\\.\\.)(?!.*\\\\)[^:*?\"<>|]+$", "maxLength": 200 },
    "license": {
      "type": "object",
      "required": ["spdx", "name", "url"],
      "additionalProperties": false,
      "properties": {
        "spdx": { "type": "string" },
        "name": { "type": "string" },
        "url": { "$ref": "#/$defs/httpsUrl" }
      }
    },
    "root": {
      "enum": [
        "kritaResources",
        "inkscapeProfile",
        "blenderConfig",
        "blenderScripts",
        "blenderExtensions",
        "blenderExtensionConfig",
        "kdenliveData",
        "kdenliveLocalData",
        "userFonts",
        "projectTemplates"
      ]
    },
    "program": {
      "type": "object",
      "required": ["id", "name", "vendor", "category", "description", "homepage", "license", "detect", "releases"],
      "additionalProperties": false,
      "properties": {
        "id": { "$ref": "#/$defs/id" },
        "name": { "type": "string" },
        "vendor": { "type": "string" },
        "category": { "enum": ["raster", "vector", "3d", "video", "audio", "upscale", "other"] },
        "description": { "type": "string", "maxLength": 400 },
        "homepage": { "$ref": "#/$defs/httpsUrl" },
        "releaseNotesUrl": { "$ref": "#/$defs/httpsUrl" },
        "license": { "$ref": "#/$defs/license" },
        "detect": { "$ref": "#/$defs/detect" },
        "setup": {
          "type": "object",
          "required": ["packId", "versionRange", "roots"],
          "additionalProperties": false,
          "properties": {
            "packId": { "$ref": "#/$defs/id" },
            "versionRange": { "type": "string", "description": "Bereich wie \">=4.2, <6\"" },
            "roots": {
              "type": "array",
              "minItems": 1,
              "items": { "$ref": "#/$defs/root" },
              "description": "Auswahl aus im Code definierten Wurzeln – der Katalog kann KEINE Pfade setzen"
            },
            "configVersionDir": { "enum": ["none", "majorMinor"], "default": "none", "description": "Blender: <config>/<X.Y>/" }
          }
        },
        "releases": { "type": "array", "minItems": 1, "items": { "$ref": "#/$defs/release" } }
      }
    },
    "release": {
      "type": "object",
      "required": ["version", "channel", "artifacts"],
      "additionalProperties": false,
      "properties": {
        "version": { "$ref": "#/$defs/programVersion" },
        "channel": { "enum": ["stable", "lts", "preview"] },
        "releasedAt": { "type": "string", "format": "date" },
        "artifacts": { "type": "array", "items": { "$ref": "#/$defs/artifact" } }
      }
    },
    "artifact": {
      "type": "object",
      "required": ["os", "arch", "kind", "url", "fileName", "size", "sha256", "checksumSource", "unpackedSizeMax", "launch"],
      "additionalProperties": false,
      "properties": {
        "os": { "enum": ["windows", "macos", "linux"] },
        "arch": { "enum": ["x86_64", "aarch64", "universal"] },
        "kind": { "enum": ["zip", "7z", "tarXz", "tarGz", "dmg", "appImage", "sfx7z", "exeInstaller"] },
        "installerType": { "enum": ["nsis", "inno"], "description": "nur bei exeInstaller; Argumente stehen im Code" },
        "url": { "$ref": "#/$defs/httpsUrl" },
        "fileName": { "type": "string", "pattern": "^[A-Za-z0-9._+-]+$" },
        "size": { "type": "integer", "minimum": 1 },
        "sha256": { "$ref": "#/$defs/sha256" },
        "checksumSource": { "$ref": "#/$defs/httpsUrl", "description": "offizielle Prüfsummendatei/-seite, von CI gegengeprüft" },
        "checksumOrigin": { "enum": ["upstream", "cypherPinned"], "default": "upstream" },
        "signature": {
          "type": "object",
          "required": ["type", "url", "publicKeys", "fingerprints"],
          "additionalProperties": false,
          "properties": {
            "type": { "enum": ["pgp", "minisign"] },
            "enforce": { "type": "boolean", "default": true, "description": "false = nur protokollieren (schwache Upstream-Signatur)" },
            "url": { "$ref": "#/$defs/httpsUrl" },
            "publicKeys": { "type": "array", "minItems": 1, "items": { "type": "string" }, "description": "armored PGP-Schlüssel bzw. minisign-Pubkeys" },
            "fingerprints": { "type": "array", "minItems": 1, "items": { "type": "string", "pattern": "^[0-9A-Fa-f]{40}$" } }
          }
        },
        "stripComponents": { "type": "integer", "minimum": 0, "maximum": 3, "default": 0 },
        "unpackedSizeMax": { "type": "integer", "minimum": 1 },
        "macAppName": { "type": "string", "description": "Name des .app im dmg, z. B. Blender.app" },
        "launch": {
          "type": "object",
          "required": ["exe"],
          "additionalProperties": false,
          "properties": {
            "exe": { "$ref": "#/$defs/relPath", "description": "relativ zum Installationsordner bzw. Contents/MacOS im .app" },
            "exeGlob": { "type": "string", "maxLength": 200, "description": "Ersatzmuster, falls das Archiv-Layout nicht sicher bekannt ist" },
            "args": { "type": "array", "items": { "type": "string", "pattern": "^--?[a-z0-9-]+(=[A-Za-z0-9._-]+)?$" }, "maxItems": 4 },
            "fileArgs": { "enum": ["append", "none"], "default": "append" },
            "portableMarker": { "$ref": "#/$defs/relPath", "description": "Ordner, der den portablen Modus aktiviert, z. B. \"portable\" (Blender ab 4.2)" }
          }
        }
      }
    },
    "detect": {
      "type": "object",
      "additionalProperties": false,
      "properties": {
        "windows": {
          "type": "object",
          "additionalProperties": false,
          "properties": {
            "uninstallDisplayNamePrefixes": { "type": "array", "items": { "type": "string" } },
            "exeNames": { "type": "array", "items": { "type": "string" } },
            "knownPaths": { "type": "array", "items": { "type": "string" }, "description": "mit {ProgramFiles}, {LocalAppData}, * als Platzhalter" },
            "steamAppId": { "type": "integer" },
            "msStorePackageFamily": { "type": "string" }
          }
        },
        "macos": {
          "type": "object",
          "additionalProperties": false,
          "properties": {
            "bundleIds": { "type": "array", "items": { "type": "string" } },
            "appNames": { "type": "array", "items": { "type": "string" } }
          }
        },
        "linux": {
          "type": "object",
          "additionalProperties": false,
          "properties": {
            "flatpakIds": { "type": "array", "items": { "type": "string" } },
            "snapNames": { "type": "array", "items": { "type": "string" } },
            "binNames": { "type": "array", "items": { "type": "string" } },
            "appImageGlobs": { "type": "array", "items": { "type": "string" } },
            "versionProbe": { "type": "boolean", "default": false }
          }
        }
      }
    },
    "link": {
      "type": "object",
      "required": ["id", "name", "url", "description"],
      "additionalProperties": false,
      "properties": {
        "id": { "$ref": "#/$defs/id" },
        "name": { "type": "string" },
        "url": { "$ref": "#/$defs/httpsUrl" },
        "description": { "type": "string" },
        "note": { "type": "string" }
      }
    },
    "printProfile": {
      "type": "object",
      "description": "Felder 1:1 wie PrintProfile in docs/ipc-contract.ts",
      "required": [
        "id", "provider", "product", "placement", "techniques", "title", "printAreaMm", "safeAreaMm", "topMarginHintMm", "widthPresets",
        "defaultWidthMm", "targetDpi", "errorBelowDpi", "minPxPerSide", "maxPxPerSide", "warnFileBytes", "maxFileBytes",
        "acceptedUploadFormats", "color", "alpha", "strokes", "source", "assumption"
      ],
      "properties": {
        "id": { "type": "string" },
        "provider": { "const": "shirtigo" },
        "placement": { "enum": ["front", "back", "sleeveLeft", "sleeveRight", "backInside"] },
        "techniques": { "type": "array", "minItems": 1, "items": { "enum": ["dtg", "dtf"] } },
        "targetDpi": { "type": "integer", "minimum": 1 },
        "errorBelowDpi": { "type": "integer", "minimum": 1 },
        "assumption": { "type": "boolean" }
      }
    },
    "model": {
      "type": "object",
      "required": ["id", "name", "license", "url", "size", "sha256", "purpose"],
      "additionalProperties": false,
      "properties": {
        "id": { "$ref": "#/$defs/id" },
        "name": { "type": "string" },
        "license": { "$ref": "#/$defs/license" },
        "url": { "$ref": "#/$defs/httpsUrl" },
        "size": { "type": "integer", "minimum": 1 },
        "sha256": { "$ref": "#/$defs/sha256" },
        "purpose": { "const": "bgremove" }
      }
    }
  }
}
