{
  "schemaVersion": 1,
  "sequence": 1,
  "generatedAt": "2026-10-16T12:00:00Z",
  "expiresAt": "2027-04-16T00:00:00Z",
  "minAppVersion": "0.1.0",
  "programs": [
    {
      "id": "blender",
      "name": "Blender",
      "vendor": "Blender Foundation",
      "category": "3d",
      "description": "3D-Modelle im PS2-Retro-Stil für den 3D-Shop, mit Cypher-Startszene und Export-Add-on.",
      "homepage": "https://www.blender.org/",
      "releaseNotesUrl": "https://www.blender.org/download/releases/",
      "license": {
        "spdx": "GPL-3.0-or-later",
        "name": "GNU General Public License v3.0 or later",
        "url": "https://www.blender.org/about/license/"
      },
      "detect": {
        "windows": {
          "uninstallDisplayNamePrefixes": [
            "Blender"
          ],
          "exeNames": [
            "blender.exe"
          ],
          "knownPaths": [
            "{ProgramFiles}\\Blender Foundation\\Blender *\\blender.exe"
          ],
          "steamAppId": 365670
        },
        "macos": {
          "bundleIds": [
            "org.blenderfoundation.blender"
          ],
          "appNames": [
            "Blender.app"
          ]
        },
        "linux": {
          "flatpakIds": [
            "org.blender.Blender"
          ],
          "snapNames": [
            "blender"
          ],
          "binNames": [
            "blender"
          ],
          "versionProbe": true
        }
      },
      "setup": {
        "packId": "blender",
        "versionRange": ">=4.2, <6",
        "roots": [
          "blenderConfig",
          "blenderScripts",
          "blenderExtensions",
          "blenderExtensionConfig"
        ],
        "configVersionDir": "majorMinor"
      },
      "releases": [
        {
          "version": "5.2.2",
          "channel": "lts",
          "releasedAt": "2026-09-15",
          "artifacts": [
            {
              "os": "windows",
              "arch": "x86_64",
              "kind": "zip",
              "url": "https://download.blender.org/release/Blender5.2/blender-5.2.2-windows-x64.zip",
              "fileName": "blender-5.2.2-windows-x64.zip",
              "size": 404453484,
              "sha256": "3849d17a682cba006075aaa3f3597ecb5c9c30ec31035b2e092c53e40679b535",
              "checksumSource": "https://download.blender.org/release/Blender5.2/blender-5.2.2.sha256",
              "stripComponents": 1,
              "unpackedSizeMax": 1600000000,
              "launch": {
                "exe": "blender.exe",
                "fileArgs": "append",
                "portableMarker": "portable"
              }
            },
            {
              "os": "macos",
              "arch": "aarch64",
              "kind": "dmg",
              "url": "https://download.blender.org/release/Blender5.2/blender-5.2.2-macos-arm64.dmg",
              "fileName": "blender-5.2.2-macos-arm64.dmg",
              "size": 346286611,
              "sha256": "dc4125399b8bfefe283cc1624d6cfc7809d1cac20ace51072127eb371f31f210",
              "checksumSource": "https://download.blender.org/release/Blender5.2/blender-5.2.2.sha256",
              "unpackedSizeMax": 2000000000,
              "macAppName": "Blender.app",
              "launch": {
                "exe": "Blender",
                "fileArgs": "append"
              }
            },
            {
              "os": "linux",
              "arch": "x86_64",
              "kind": "tarXz",
              "url": "https://download.blender.org/release/Blender5.2/blender-5.2.2-linux-x64.tar.xz",
              "fileName": "blender-5.2.2-linux-x64.tar.xz",
              "size": 383295504,
              "sha256": "84098912789dc450e95697c4184fb8a90acbe5111c2ba4aede3fecb57806a168",
              "checksumSource": "https://download.blender.org/release/Blender5.2/blender-5.2.2.sha256",
              "stripComponents": 1,
              "unpackedSizeMax": 1800000000,
              "launch": {
                "exe": "blender",
                "fileArgs": "append",
                "portableMarker": "portable"
              }
            }
          ]
        },
        {
          "version": "4.5.14",
          "channel": "lts",
          "releasedAt": "2026-09-15",
          "artifacts": [
            {
              "os": "macos",
              "arch": "x86_64",
              "kind": "dmg",
              "url": "https://download.blender.org/release/Blender4.5/blender-4.5.14-macos-x64.dmg",
              "fileName": "blender-4.5.14-macos-x64.dmg",
              "size": 340090796,
              "sha256": "613e73339e97bd113adeeb28d9155beeacf2df7119ee4dbd6bdce234843645f6",
              "checksumSource": "https://download.blender.org/release/Blender4.5/blender-4.5.14.sha256",
              "unpackedSizeMax": 2000000000,
              "macAppName": "Blender.app",
              "launch": {
                "exe": "Blender",
                "fileArgs": "append"
              }
            }
          ]
        }
      ]
    },
    {
      "id": "krita",
      "name": "Krita",
      "vendor": "KDE / Krita Foundation",
      "category": "raster",
      "description": "Digitale Malerei und Motive für den Druck: Paletten, Vorlagen und Schriften der Cypher-Kollektionen.",
      "homepage": "https://krita.org/",
      "releaseNotesUrl": "https://krita.org/en/item/krita-5-3-release-notes/",
      "license": {
        "spdx": "GPL-3.0-or-later",
        "name": "GNU General Public License v3.0 or later",
        "url": "https://krita.org/en/about/krita/"
      },
      "detect": {
        "windows": {
          "uninstallDisplayNamePrefixes": [
            "Krita"
          ],
          "exeNames": [
            "krita.exe"
          ],
          "knownPaths": [
            "{ProgramFiles}\\Krita (x64)\\bin\\krita.exe"
          ]
        },
        "macos": {
          "bundleIds": [
            "org.krita"
          ],
          "appNames": [
            "krita.app"
          ]
        },
        "linux": {
          "flatpakIds": [
            "org.kde.krita"
          ],
          "snapNames": [
            "krita"
          ],
          "binNames": [
            "krita"
          ],
          "appImageGlobs": [
            "krita-*.AppImage"
          ]
        }
      },
      "setup": {
        "packId": "krita",
        "versionRange": ">=5.2, <6",
        "roots": [
          "kritaResources",
          "userFonts"
        ]
      },
      "releases": [
        {
          "version": "5.3.4.1",
          "channel": "stable",
          "releasedAt": "2026-10-07",
          "artifacts": [
            {
              "os": "windows",
              "arch": "x86_64",
              "kind": "zip",
              "url": "https://download.kde.org/stable/krita/5.3.4.1/krita-x64-5.3.4.1.zip",
              "fileName": "krita-x64-5.3.4.1.zip",
              "size": 227787916,
              "sha256": "eda810059a120171d30d4661c7684c73a8feb72b01ad5709531cbebe6b84d032",
              "checksumSource": "https://download.kde.org/stable/krita/5.3.4.1/krita-x64-5.3.4.1.zip.sha256",
              "stripComponents": 1,
              "unpackedSizeMax": 1500000000,
              "launch": {
                "exe": "bin/krita.exe",
                "fileArgs": "append"
              }
            },
            {
              "os": "macos",
              "arch": "universal",
              "kind": "dmg",
              "url": "https://download.kde.org/stable/krita/5.3.4.1/krita-5.3.4.1-signed.dmg",
              "fileName": "krita-5.3.4.1-signed.dmg",
              "size": 392023759,
              "sha256": "531e261da1fd8d5c468cfcd4eebd16e9edf6ab320e89406d2875f2e43c1148de",
              "checksumSource": "https://download.kde.org/stable/krita/5.3.4.1/krita-5.3.4.1-signed.dmg.sha256",
              "unpackedSizeMax": 1500000000,
              "macAppName": "krita.app",
              "launch": {
                "exe": "krita",
                "fileArgs": "append"
              }
            },
            {
              "os": "linux",
              "arch": "x86_64",
              "kind": "appImage",
              "url": "https://download.kde.org/stable/krita/5.3.4.1/krita-5.3.4.1-x86_64.AppImage",
              "fileName": "krita-5.3.4.1-x86_64.AppImage",
              "size": 381635064,
              "sha256": "e315dfb3da81cdb8bddc4bb3fcd4d9bacd0630fc7065d8ed07de758b267573f0",
              "checksumSource": "https://download.kde.org/stable/krita/5.3.4.1/krita-5.3.4.1-x86_64.AppImage.sha256",
              "signature": {
                "type": "pgp",
                "enforce": true,
                "url": "https://download.kde.org/stable/krita/5.3.4.1/krita-5.3.4.1-x86_64.AppImage.sig",
                "publicKeys": [